text,label,intent,is_seed,text_clean
passt das zeitfenster für dich oder isch s z knapp?,neutral,orga,True,passt das zeitfenster fuer dich oder isch s z knapp
söll ich im vorus no öppis vorbereite?,neutral,orga,True,soell ich im vorus no oeppis vorbereite
wie wottsch s lieber – kurz und unkompliziert oder detailliert?,neutral,orga,True,wie wottsch s lieber kurz und unkompliziert oder detailliert
ischs äntweder-oder oder beidi optione möglich bi dir?,neutral,orga,True,ischs aentweder oder oder beidi optione moeglich bi dir
"wöllmer grad zwei date fix mache, falls eins nöd passt?",neutral,orga,True,woellmer grad zwei date fix mache falls eins ned passt
chan ich dir alternativ uhrzeite schicke?,neutral,orga,True,chan ich dir alternativ uhrzeite schicke
isch diese wuche realistischer oder eher nöchschti?,neutral,orga,True,isch diese wuche realistischer oder eher noechschti
wöllmer s spontan lah und morn no mal abgleiche?,neutral,orga,True,woellmer s spontan lah und morn no mal abgleiche
wo wär für dich am angenehmste ort fürs treffen?,neutral,orga,True,wo waer fuer dich am angenehmste ort fuers treffen
söll ich dini koordinatig überneh und lüt ahschriebe?,neutral,orga,True,soell ich dini koordinatig ueberneh und luet ahschriebe
"passt es dir, wenn ich no paar sache organisiere?",neutral,orga,True,passt es dir wenn ich no paar sache organisiere
wöllmer das kurz via chat oder lieber mitem call abgleiche?,neutral,orga,True,woellmer das kurz via chat oder lieber mitem call abgleiche
wie funktionieret das eigentlich im detail?,neutral,frage_info,True,wie funktionieret das eigentlich im detail
"chasch mir kurz erkläre, was ich genau mues mache?",neutral,frage_info,True,chasch mir kurz erklaere was ich genau mues mache
was würdisch als bescht option aaluege?,neutral,frage_info,True,was wuerdisch als bescht option aaluege
wie lauft dä prozess normalerwiis ab?,neutral,frage_info,True,wie lauft dae prozess normalerwiis ab
was isch dä unterschied zwüsche däne zwöi varianten?,neutral,frage_info,True,was isch dae unterschied zwuesche daene zwoei varianten
"gits öppis, wo ich vorhär unbedingt sött wüsse?",neutral,frage_info,True,gits oeppis wo ich vorhaer unbedingt soett wuesse
mues ich dafür irgendöppis speziells vorbereite?,neutral,frage_info,True,mues ich dafuer irgendoeppis speziells vorbereite
"chan ich das spöter no ändere, falls s nötig isch?",neutral,frage_info,True,chan ich das spoeter no aendere falls s noetig isch
hesch selber erfahrung mit dem gha?,neutral,frage_info,True,hesch selber erfahrung mit dem gha
wie lang nimmt das ungefähr i anspruch?,neutral,frage_info,True,wie lang nimmt das ungefaehr i anspruch
"was bruch ich alles, um das korrekt z mache?",neutral,frage_info,True,was bruch ich alles um das korrekt z mache
was wär dä logische erste schritt?,neutral,frage_info,True,was waer dae logische erste schritt
für was isch das eigentlich genau gmacht?,neutral,frage_info,True,fuer was isch das eigentlich genau gmacht
brauchts dafür en account oder gaht s ohni?,neutral,frage_info,True,brauchts dafuer en account oder gaht s ohni
"chan ich das testweise usprobiere, bevor ich mich entscheide?",neutral,frage_info,True,chan ich das testweise usprobiere bevor ich mich entscheide
mues ich bi öppis bestimmtem speziell ufpasse?,neutral,frage_info,True,mues ich bi oeppis bestimmtem speziell ufpasse
welchi variante würdisch du spontan empfehle?,neutral,frage_info,True,welchi variante wuerdisch du spontan empfehle
wie isch dä gewöhnliche ablauf bi dem?,neutral,frage_info,True,wie isch dae gewoehnliche ablauf bi dem
"gits sache, wo mer schnell verwechslet bi dem thema?",neutral,frage_info,True,gits sache wo mer schnell verwechslet bi dem thema
isch das kompliziert oder würdisch säge eher easy?,neutral,frage_info,True,isch das kompliziert oder wuerdisch saege eher easy
"was passiert, wenn ich dä schritt falsch mach?",neutral,frage_info,True,was passiert wenn ich dae schritt falsch mach
chan ich fähler im nachhinein korrigiere?,neutral,frage_info,True,chan ich faehler im nachhinein korrigiere
mues ich dafür eventuell support ahhole?,neutral,frage_info,True,mues ich dafuer eventuell support ahhole
"gits typischerweise öppis, wo mer gern übersiht?",neutral,frage_info,True,gits typischerweise oeppis wo mer gern uebersiht
wie würdisch du persönlich das aagoh?,neutral,frage_info,True,wie wuerdisch du persoenlich das aagoh
was sind so die vor- und nachteili vo dä lösig?,neutral,frage_info,True,was sind so die vor und nachteili vo dae loesig
welches tool bruucht mer ide regel am effizienteste?,neutral,frage_info,True,welches tool bruucht mer ide regel am effizienteste
"isch relevant, wie genau ich das formuliere?",neutral,frage_info,True,isch relevant wie genau ich das formuliere
mues ich en bestimmte reihenfolg iihalte?,neutral,frage_info,True,mues ich en bestimmte reihenfolg iihalte
"wie chasch mir das am eifachste i zwei, drü sätz erkläre?",neutral,frage_info,True,wie chasch mir das am eifachste i zwei drue saetz erklaere
"isch mir imfall relativ egal, wie mer s mache",neutral,sonstiges,True,isch mir im fall relativ egal wie mer s mache
mer chönd s gern eifach offen lah und luege,neutral,sonstiges,True,mer choend s gern eifach offen lah und luege
"mir lueged mal, was sich draus ergit",neutral,sonstiges,True,mir lueged mal was sich draus ergit
"han no kei klare meinig dezue, ehrlich",neutral,sonstiges,True,han no kei klare meinig dezue ehrlich
chömer s gern spontan entscheide,neutral,sonstiges,True,choemer s gern spontan entscheide
es muess definitiv nöd hüt sii,neutral,sonstiges,True,es muess definitiv ned huet sii
für mich sind beidi wege absolut okay,neutral,sonstiges,True,fuer mich sind beidi wege absolut okay
so wichtig isch s imfall würkli nöd,neutral,sonstiges,True,so wichtig isch s im fall wuerkli ned
mer chönd s eifach no chli beobachte,neutral,sonstiges,True,mer choend s eifach no chli beobachte
finds weder besonders guet noch schlecht,neutral,sonstiges,True,finds weder besonders guet noch schlecht
bi da eigentlich recht flexibel,neutral,sonstiges,True,bi da eigentlich recht flexibel
chan mich dem ganz easy ahpasse,neutral,sonstiges,True,chan mich dem ganz easy ahpasse
"es spielt kei riesigi roll, wie mer s umegsetze",neutral,sonstiges,True,es spielt kei riesigi roll wie mer s umegsetze
han da ehrlich kei priorität,neutral,sonstiges,True,han da ehrlich kei prioritaet
"für mich isch s chillig, wie mer s mache",neutral,sonstiges,True,fuer mich isch s chillig wie mer s mache
"mer chönd s au verschiebe, falls s nöd passt",neutral,sonstiges,True,mer choend s au verschiebe falls s ned passt
bi da ganz entspannt und offen,neutral,sonstiges,True,bi da ganz entspannt und offen
"mir isch s grundsätzlich egal, würkli",neutral,sonstiges,True,mir isch s grundsaetzlich egal wuerkli
han kei stärk preference i die riichtung,neutral,sonstiges,True,han kei staerk preference i die riichtung
es muess nöd grad jetzt erledigt werde,neutral,sonstiges,True,es muess ned grad jetzt erledigt werde
mer chönd s locker u meg eifach halte,neutral,sonstiges,True,mer choend s locker u meg eifach halte
ich cha mit de meiste optione guet läbe,neutral,sonstiges,True,ich chan mit de meiste optione guet laebe
"find, mer sött s nöd überkompliziere",neutral,sonstiges,True,find mer soett s ned ueberkompliziere
"isch nöd es thema, wo mich stresst",neutral,sonstiges,True,isch ned es thema wo mich stresst
"wenn s dir lieber isch, chömer s spontan lösä",neutral,sonstiges,True,wenn s dir lieber isch choemer s spontan loesae
bin nöd wahnsinnig investiert i die frag,neutral,sonstiges,True,bi ned wahnsinnig investiert i die frag
beidi varianten tönd absolut okay für mich,neutral,sonstiges,True,beidi varianten toend absolut okay fuer mich
"bi da völlig offen, ehrlich",neutral,sonstiges,True,bi da voellig offen ehrlich
"mer mache s eifach so, wie s grad am bestä passt",neutral,sonstiges,True,mer mache s eifach so wie s grad am bestae passt
"glaub, das chunt scho guet, egal wie mer s löse",neutral,sonstiges,True,glaub das chunnt scho guet egal wie mer s loese
"kurzes update: es lauft imfall solid, aber langsam",neutral,status_update,True,kurzes update es lauft im fall solid aber langsam
bin grad mitten im process und mach Schritt für Schritt,neutral,status_update,True,bi grad mitten im process und mach schritt fuer schritt
"no nöd alles fertig, aber ich bi dr blibe",neutral,status_update,True,no ned alles fertig aber ich bi dr blibe
"s gröbschte isch done, jetzt bruuchts no feinarbeit",neutral,status_update,True,s groebschte isch done jetzt bruuchts no feinarbeit
"bin no nöd ganz am ziel, aber nah drann",neutral,status_update,True,bi no ned ganz am ziel aber nah drann
"bis jetzt isch alles stabil, nüt eskaliert",neutral,status_update,True,bis jetzt isch alles stabil nuet eskaliert
"es het sich chli öppis beweegt, langsam aber sicher",neutral,status_update,True,es het sich chli oeppis beweegt langsam aber sicher
"im momänt chömed viel sache zäme, aber isch im rahme",neutral,status_update,True,im momaent choemed viel sache zaeme aber isch im rahme
"es lauft, aber ich bruuch no chli zit für dä rest",neutral,status_update,True,es lauft aber ich bruuch no chli zit fuer dae rest
"gib dir bschaid, sobald öppis neus passiert",neutral,status_update,True,gib dir bschaid sobald oeppis neus passiert
"progress isch da, aber eher im slow-motion-style",neutral,status_update,True,progress isch da aber eher im slow motion style
"bin steady am schaffe, es chunnt Schritt für Schritt",neutral,status_update,True,bi steady am schaffe es chunnt schritt fuer schritt
"nöd mega spannend grad, aber es geht vorwärts",neutral,status_update,True,ned mega spannend grad aber es geht vorwaerts
update: ich bi no voll im arbeitsmodus,neutral,status_update,True,update ich bi no voll im arbeitsmodus
"es isch no weni fertig, aber s zeichnet sich ab",neutral,status_update,True,es isch no weni fertig aber s zeichnet sich ab
mues no paar dinge usbügle,neutral,status_update,True,mues no paar dinge usbuegle
"ich arbeite dran, Schrittli für Schrittli",neutral,status_update,True,ich arbeite dran schrittli fuer schrittli
"bin imfall no dra, kei stress",neutral,status_update,True,bi im fall no dra kei stress
status: würd säge ca. 80% funktionieren aktuell,neutral,status_update,True,status wuerd saege ca <NUM> funktionieren aktuell
bruucht halt eifach no chli geduld,neutral,status_update,True,bruucht halt eifach no chli geduld
bin grad am teste vo verschidene variante,neutral,status_update,True,bi grad am teste vo verschidene variante
"mues no sicherheitsschritt mache, bevor ich’s final mach",neutral,status_update,True,mues no sicherheitsschritt mache bevor ich s final mach
bin am dokumentiere – das nimmt chli zit,neutral,status_update,True,bi am dokumentiere das nimmt chli zit
es isch guet unterwegs und macht sinn so,neutral,status_update,True,es isch guet unterwegs und macht sinn so
"ich mach morn wiiter, hüt isch gnue gsi",neutral,status_update,True,ich mach morn wiiter huet isch gnue gsi
"het sich nöd viel verändere, aber mini liste schrumpft",neutral,status_update,True,het sich ned viel veraendere aber mini liste schrumpft
"bin grad am durchackere, aber alles ok",neutral,status_update,True,bi grad am durchackere aber alles ok
habe grad de status aktualisiert – chli Fortschritt isch da,neutral,status_update,True,habe grad de status aktualisiert chli fortschritt isch da
"zwüschet dur chli stress, aber grundsätzlich ok",neutral,status_update,True,zwueschet dur chli stress aber grundsaetzlich ok
"meld mi wieder, sobald ich klarheit ha",neutral,status_update,True,meld mi wieder sobald ich klarheit ha
"bin grad drann, mini langfristige plän chli z ordne",neutral,planung_langfristig,True,bi grad drann mini langfristige plaen chli z ordne
"überleg mir, wie s nöchschte jahr ungefähr sött usegseh",neutral,planung_langfristig,True,ueberleg mir wie s noechschte jahr ungefaehr soett usegseh
"ha no nöd alles klar, aber ich wott meh struktur iibringe",neutral,planung_langfristig,True,ha no ned alles klar aber ich wott meh struktur iibringe
probier imfall chli vorus z plane statt nur spontan,neutral,planung_langfristig,True,probier im fall chli vorus z plane statt nur spontan
möcht mir paar realischtischi ziel setze fürs nöchschti,neutral,planung_langfristig,True,moecht mir paar realischtischi ziel setze fuers noechschti
"lueg grad, wie sich job und privat besser verbinde lah",neutral,planung_langfristig,True,lueg grad wie sich job und privat besser verbinde lah
wott meh ruhe und stabilität i mini plän ine bringe,neutral,planung_langfristig,True,wott meh ruhe und stabilitaet i mini plaen ine bringe
"mues no ussortiere, was mir langfristig würkli wichtig isch",neutral,planung_langfristig,True,mues no ussortiere was mir langfristig wuerkli wichtig isch
"denk grad vil drüber nach, wohi s über Zyt wott go",neutral,planung_langfristig,True,denk grad vil drueber nach wohi s ueber zyt wott go
"ändere Schritt für Schritt paar sache, aber nüt überstürzt",neutral,planung_langfristig,True,aendere schritt fuer schritt paar sache aber nuet ueberstuerzt
möcht mini ressourcen langfristig gscheiter nutze,neutral,planung_langfristig,True,moecht mini ressourcen langfristig gscheiter nutze
probier e chli klarheit i mis grössers bild z bringe,neutral,planung_langfristig,True,probier e chli klarheit i mis groessers bild z bringe
bin am reflexiere über min nöchschti weg,neutral,planung_langfristig,True,bi am reflexiere ueber min noechschti weg
langfristig wott ich es paar gewohnheite ändere,neutral,planung_langfristig,True,langfristig wott ich es paar gewohnheite aendere
"möcht luege, was nachhaltig zu mir passt",neutral,planung_langfristig,True,moecht luege was nachhaltig zu mir passt
versueche s grössere ganze besser z überblicke,neutral,planung_langfristig,True,versueche s groessere ganze besser z ueberblicke
"ha s gfühl, ich bruche chli neui orientierig",neutral,planung_langfristig,True,ha s gfuehl ich bruche chli neui orientierig
"wott guet vorbereitet sii uf s, was chönnt chöme",neutral,planung_langfristig,True,wott guet vorbereitet sii uf s was choennt choeme
möcht mini ziele realistischer und weniger stressig setze,neutral,planung_langfristig,True,moecht mini ziele realistischer und weniger stressig setze
"ha s gfühl, ich wachse langsam i öppis neus ine",neutral,planung_langfristig,True,ha s gfuehl ich wachse langsam i oeppis neus ine
"plane imfall eher langsam, aber überlegt",neutral,planung_langfristig,True,plane im fall eher langsam aber ueberlegt
"ha es visionli im chopf, aber no nöd alles usformuliert",neutral,planung_langfristig,True,ha es visionli im chopf aber no ned alles usformuliert
wott langfristig meh stabilität ufbaue,neutral,planung_langfristig,True,wott langfristig meh stabilitaet ufbaue
probier bewusster und nöd automatisch z entscheide,neutral,planung_langfristig,True,probier bewusster und ned automatisch z entscheide
reflektiere im momänt vil über mini zukunftsrichtung,neutral,planung_langfristig,True,reflektiere im momaent vil ueber mini zukunftsrichtung
möcht mini priorität chli neu sortiere,neutral,planung_langfristig,True,moecht mini prioritaet chli neu sortiere
"lüge grad, weli strategie längerfristig gscheit wär",neutral,planung_langfristig,True,luege grad weli strategie laengerfristig gscheit waer
wott langfristig meh ruum für mich selber ha,neutral,planung_langfristig,True,wott langfristig meh ruum fuer mich selber ha
"plane chli, wie ich Schritt für Schritt wiitercho wott",neutral,planung_langfristig,True,plane chli wie ich schritt fuer schritt wiitercho wott
"probier d richtung z spüre, bevor ich grössers aareiss",neutral,planung_langfristig,True,probier d richtung z spuere bevor ich groessers aareiss
"chli feedback: es isch übersichtlich, aber no nöd ganz klar strukturiert",neutral,feedback_sachlich,True,chli feedback es isch uebersichtlich aber no ned ganz klar strukturiert
"grundsätzlich guet umegsetzt, aber es het sicher optimierungspotenzial",neutral,feedback_sachlich,True,grundsaetzlich guet umegsetzt aber es het sicher optimierungspotenzial
"vo minere sicht her funktioniert s, aber d dokumentation chönnt präziser sii",neutral,feedback_sachlich,True,vo minere sicht her funktioniert s aber d dokumentation choennt praeziser sii
"ich find s sachlich okay, d struktur stimmt soweit",neutral,feedback_sachlich,True,ich find s sachlich okay d struktur stimmt soweit
würd eventuell no meh erläuterige a paar stelle ergänze,neutral,feedback_sachlich,True,wuerd eventuell no meh erlaeuterige a paar stelle ergaenze
d zeitplän chönd mer chli straffer formuliere,neutral,feedback_sachlich,True,d zeitplaen choend mer chli straffer formuliere
"inhaltlich solid, optisch chönd mer s sicher nachschärfe",neutral,feedback_sachlich,True,inhaltlich solid optisch choend mer s sicher nachschaerfe
"es isch lösbar, aber d anleitig isch eher knapp",neutral,feedback_sachlich,True,es isch loesbar aber d anleitig isch eher knapp
"find s fair formuliert, aber chli streng im ton",neutral,feedback_sachlich,True,find s fair formuliert aber chli streng im ton
"vo mir us en nüchterne, aber positive rückmeldung",neutral,feedback_sachlich,True,vo mir us en nuechterne aber positive rueckmeldung
"es isch guet gmacht, aber nöd ganz konsistent i de detail",neutral,feedback_sachlich,True,es isch guet gmacht aber ned ganz konsistent i de detail
"würd empfehle, no e paar beispiel dezue z nehme",neutral,feedback_sachlich,True,wuerd empfehle no e paar beispiel dezue z nehme
"d gliederig isch logisch, aber wirkt chli steif",neutral,feedback_sachlich,True,d gliederig isch logisch aber wirkt chli steif
"würd mall ueluege, öb mer s chli flüssiger mache cha",neutral,feedback_sachlich,True,wuerd mall ueluege oeb mer s chli fluessiger mache chan
"sachlich i ordnig, aber wenig dynamisch",neutral,feedback_sachlich,True,sachlich i ordnig aber wenig dynamisch
mini rückmeldung: meh details an kritische stelle wär helpful,neutral,feedback_sachlich,True,mini rueckmeldung meh details an kritische stelle waer helpful
"solid arbeit, aber e chli trocken i de lesbarkeit",neutral,feedback_sachlich,True,solid arbeit aber e chli trocken i de lesbarkeit
würd eventuell visuelle element ergänze für d übersicht,neutral,feedback_sachlich,True,wuerd eventuell visuelle element ergaenze fuer d uebersicht
"verständlich isch s, aber recht lang i de form",neutral,feedback_sachlich,True,verstaendlich isch s aber recht lang i de form
würd d abschnitt e chli klarer voneinander trenne,neutral,feedback_sachlich,True,wuerd d abschnitt e chli klarer voneinander trenne
"es het struktur, aber vereinzlet wirkt s chli chaotisch",neutral,feedback_sachlich,True,es het struktur aber vereinzlet wirkt s chli chaotisch
"grundsätzlich guet, aber chli z technisch formuliert",neutral,feedback_sachlich,True,grundsaetzlich guet aber chli z technisch formuliert
en leichtes redesign chönnt s klarer mache,neutral,feedback_sachlich,True,en leichtes redesign choennt s klarer mache
"het substanz, aber paar stelle sind repetitiv",neutral,feedback_sachlich,True,het substanz aber paar stelle sind repetitiv
mini empfehlig: meh praxisbezug würd helfen,neutral,feedback_sachlich,True,mini empfehlig meh praxisbezug wuerd helfen
"würd s grundsätzlich eso loh, aber verbesserbar isch s immer",neutral,feedback_sachlich,True,wuerd s grundsaetzlich eso loh aber verbesserbar isch s immer
"logisch umegsetzt, aber e chli wenig intuitiv",neutral,feedback_sachlich,True,logisch umegsetzt aber e chli wenig intuitiv
chli kürze würd de text sicher lese-freundlicher mache,neutral,feedback_sachlich,True,chli kuerze wuerd de text sicher lese freundlicher mache
"ha s nüchtern analysiert – stabil, aber no luftig",neutral,feedback_sachlich,True,ha s nuechtern analysiert stabil aber no luftig
"es isch guet, aber nöd grad herausragend",neutral,feedback_sachlich,True,es isch guet aber ned grad herausragend
bin grad wieder vil am gamä in de freizit,neutral,hobby_talk,True,bi grad wieder vil am gamae in de freizit
"go gern jogge, wenn ich dä chopf lüfte möcht",neutral,hobby_talk,True,go gern jogge wenn ich dae chopf luefte moecht
"ha wieder aagfange meh z läse, tut guet",neutral,hobby_talk,True,ha wieder aagfange meh z laese tut guet
bin momentan voll im kochfilm und probier rezepte us,neutral,hobby_talk,True,bi momentan voll im kochfilm und probier rezepte us
lueg grad vil series zum abschalte,neutral,hobby_talk,True,lueg grad vil series zum abschalte
musik lose beruhigt mi mega im alltag,neutral,hobby_talk,True,musik lose beruhigt mi mega im alltag
übe grad wieder chli uf mim instrument,neutral,hobby_talk,True,uebe grad wieder chli uf mim instrument
"ha neu mit fotografie aagfange, macht spass",neutral,hobby_talk,True,ha neu mit fotografie aagfange macht spass
"bi gerne drausse unterwägs, wenn s wetter mitmacht",neutral,hobby_talk,True,bi gerne drausse unterwaegs wenn s wetter mitmacht
versueche grad meh kreativität i mis läbe z bringe,neutral,hobby_talk,True,versueche grad meh kreativitaet i mis laebe z bringe
mach imfall gern chli bastel- oder diy-projekt,neutral,hobby_talk,True,mach im fall gern chli bastel oder diy projekt
ha wieder meh lust uf games aktuell,neutral,hobby_talk,True,ha wieder meh lust uf games aktuell
probier grad en neue workout-routine us,neutral,hobby_talk,True,probier grad en neue workout routine us
experimentier i de chuchi mit neue rezept,neutral,hobby_talk,True,experimentier i de chuchi mit neue rezept
"bin gerne am stricke oder häkle, mega entspannend",neutral,hobby_talk,True,bi gerne am stricke oder haekle mega entspannend
les grad en recht spannende romanreihe,neutral,hobby_talk,True,les grad en recht spannende romanreihe
"zeichne viel i de letzte zit, tut mer guet",neutral,hobby_talk,True,zeichne viel i de letzte zit tut mer guet
ha wieder zum skateboard gfunde,neutral,hobby_talk,True,ha wieder zum skateboard gfunde
verbringe gern zit i de natur zum abschalte,neutral,hobby_talk,True,verbringe gern zit i de natur zum abschalte
"cha stundenlang podcasts lose, voll mini welt",neutral,hobby_talk,True,chan stundenlang podcasts lose voll mini welt
lern grad öppis neus im bereich design,neutral,hobby_talk,True,lern grad oeppis neus im bereich design
"probier grad en neue sportart us, mal luege wies wird",neutral,hobby_talk,True,probier grad en neue sportart us mal luege wies wird
gärtnere imfall mega gern – isch richtig chillig,neutral,hobby_talk,True,gaertnere im fall mega gern isch richtig chillig
interessier mi grad chli für astronomie,neutral,hobby_talk,True,interessier mi grad chli fuer astronomie
"sammle seit churzem vinylplatte, mega spannend",neutral,hobby_talk,True,sammle seit churzem vinylplatte mega spannend
musigiere gern und improvisiere eifach druuflos,neutral,hobby_talk,True,musigiere gern und improvisiere eifach druuflos
entdeck grad paar alte hobbys wieder neu,neutral,hobby_talk,True,entdeck grad paar alte hobbys wieder neu
experimentiere imfall mit digital art und tablets,neutral,hobby_talk,True,experimentiere im fall mit digital art und tablets
"puzzle gern, finds mega beruhigend",neutral,hobby_talk,True,puzzle gern finds mega beruhigend
"ha allgemein gern alles, wo kreativität bruucht",neutral,hobby_talk,True,ha allgemein gern alles wo kreativitaet bruucht
"hesch gseh, was grad i de nöi passiert isch?",neutral,news_teilen,True,hesch gseh was grad i de noei passiert isch
ich ha en spannende artikel über das thema glese,neutral,news_teilen,True,ich ha en spannende artikel ueber das thema glese
es het wieder es update zu dere sach geh,neutral,news_teilen,True,es het wieder es update zu dere sach go
"imfall, d app het jetzt es neus feature übercho",neutral,news_teilen,True,imfall d app het jetzt es neus feature uebercho
"ich ha ghört, dass sich öppis a de regel gänderet het",neutral,news_teilen,True,ich ha ghoert dass sich oeppis a de regel gaenderet het
grad im bereich git s en interessante entwicklung,neutral,news_teilen,True,grad im bereich git s en interessante entwicklung
"bin über en beitrag gstolpert, wo perfekt zum thema passt",neutral,news_teilen,True,bi ueber en beitrag gstolpert wo perfekt zum thema passt
i de nöi git s grad vil diskussion drum,neutral,news_teilen,True,i de noei git s grad vil diskussion drum
"es git en neus projekt, wo chönt spannend wärde",neutral,news_teilen,True,es git en neus projekt wo choent spannend waerde
"ha gseh, dass d termi chli gschobe worde sind",neutral,news_teilen,True,ha gseh dass d termi chli gschobe worde sind
ich ha öppis spannends uf social media ufglese,neutral,news_teilen,True,ich ha oeppis spannends uf social media ufglese
"es het en bericht geh, wo ich recht interessant gfunde ha",neutral,news_teilen,True,es het en bericht geh wo ich recht interessant gfunde ha
"gibts es update zur situation, falls di das interessiert",neutral,news_teilen,True,gibts es update zur situation falls di das interessiert
"ha grad es kurzes video gseh, wo guet erklärt, was lauft",neutral,news_teilen,True,ha grad es kurzes video gseh wo guet erklaert was lauft
es het en neue entwurf für die regelige geh,neutral,news_teilen,True,es het en neue entwurf fuer die regelige go
ha grad en newsletter zue dem thema übercho,neutral,news_teilen,True,ha grad en newsletter zue dem thema uebercho
im technologiebereich het s öppis neus geh,neutral,news_teilen,True,im technologiebereich het s oeppis neus go
"bin über en artikel gstolpert, wo relevant chönnt sii",neutral,news_teilen,True,bi ueber en artikel gstolpert wo relevant choennt sii
"ha gseh, dass en event fasch hätt müesse verschobe werde",neutral,news_teilen,True,ha gseh dass en event fasch haett mueesse verschobe werde
"es het neue info, aber no nöd ganz bestätigt",neutral,news_teilen,True,es het neue info aber no ned ganz bestaetigt
