user_text,user_text_clean,label,intent,answer_mundart,needs_review,is_seed
"ich ha feedback übercho, dass mini arbeit sehr guet isch gsi schönä tag no",ich ha feedback uebercho dass mini arbeit sehr guet isch gsi schoenae tag no,positiv,erfolg,"Gratuliere, das isch en schöne erfolg. Nimm dir ruhig en moment, zum stolz z sii.",True,False
das macht mi wirklich glücklich,das macht mi wirklich gluecklich,positiv,freud,"Mega schön, dass dich das so freut. Erzähl gern no meh drüber, wenn du wotsch.",True,False
"ich schätz es mega, so mensche um mich z ha eifach stark lg",ich schaetz es mega so mensche um mich z ha eifach stark lg,positiv,verbindung_freunde,"Schön, dass du so mensche um dich hesch. Solchi momänt tue mega guet.",True,False
"ich weiss nöd, wie ich mit dem umgah söll",ich weiss noed wie ich mit dem umgah soell,negativ,konflikt,Konflikt sind nöd eifach. Was isch dir da besonders wichtig i dä situation?,True,True
"hallo du, mini app spinnt scho wieder und ich weiss nöd, wieso ciao",hallo du mini app spinnt scho wieder und ich weiss noed wieso ciao,neutral,technik_support,"Okay, luegemer zäme druf. Was genau funktioniert im momänt nöd so, wie s sött?",True,False
"es lauft nöd perfekt, aber es stimmt für mich",es lauft ned perfekt aber es stimmt fuer mich,positiv,zufriedenheit_alltag,"Schön, dass sich dis läbe im momänt stimmig aafühlt. Was wotsch gern so biibe lah?",True,False
"ich ha s gfühl, ich chan grad vil bewege lg",ich ha s gfuehl ich chan grad vil bewege lg,positiv,motivation,Das tönt nach vill energie. Wie wotsch die motivation für dich nutze?,True,False
"ich ha s gfühl, jetzt isch en guete zeitpunkt zum starte zum sich freue",ich ha s gfuehl jetzt isch en guete zeitpunkt zum starte zum sich freue,positiv,motivation,Das tönt nach vill energie. Wie wotsch die motivation für dich nutze?,True,False
"jo, ich bruch nur chli hilf, zum das technisch wieder zum laufe bringe mal luege",jo ich bruch nur chli hilf zum das technisch wieder zum laufe bringe mal luege,neutral,technik_support,"Okay, luegemer zäme druf. Was genau funktioniert im momänt nöd so, wie s sött?",True,False
ich bi scho wieder enttäuscht,ich bi scho wieder enttaeuscht,negativ,beschwerde,"Das tönt würklich müehsam. Erzähl gern no chli meh, was genau di stört.",True,True
"merci, dass du dir d zit gnoh hesch",merci dass du dir d zit gnoh hesch,positiv,dank,"Sehr gärn. Freut mi, wenn es dir öppis bringt.",True,False
"hey, hoi, was machsch grad so?",hey hoi was machsch grad so,neutral,smalltalk,"Mir gohts guet, merci. Und dir so im alltag?",True,False
"ich finds sachlich okay umgsetzt, d struktur isch logisch",ich finds sachlich okay umgsetzt d struktur isch logisch,neutral,feedback_sachlich,"Danke fürs sachlich feedback. Das hilft, s besser iigschätze z chönne.",True,True
ich han no kei klare meinig dezue,ich han no kei klare meinig dezue,neutral,sonstiges,"Alles klar, merci für dini rückmeldung.",True,False
"es isch no nöd alles fertig, aber ich bi druf und dra",es isch no ned alles fertig aber ich bi druf und dra,neutral,status_update,"Merci fürs update. Wenn sich öppis ändert, chasch eifach wieder schriebe.",True,False
mir rede ane vorbei und nüt chunt a zum verseckä,mir rede ane vorbei und nuet chunnt a zum verseckae,negativ,konflikt,Konflikt sind nöd eifach. Was isch dir da besonders wichtig i dä situation?,True,False
ich bi dir würkli dankbar,ich bi dir wuerkli dankbar,positiv,dank,"Sehr gärn. Freut mi, wenn es dir öppis bringt.",True,False
"hallo du, ich freu mi sogar uf d nägschti aufgabä",hallo du ich freu mi sogar uf d naegschti aufgabae,positiv,motivation,Das tönt nach vill energie. Wie wotsch die motivation für dich nutze?,True,False
"hallo du, ich bi stolz, dass ich das durchzoge ha eifach nur schön",hallo du ich bi stolz dass ich das durchzoge ha eifach nur schoen,positiv,erfolg,"Gratuliere, das isch en schöne erfolg. Nimm dir ruhig en moment, zum stolz z sii.",True,False
ich find s weder mega guet no extrem schlecht,ich find s weder mega guet no extrem schlecht,neutral,sonstiges,"Alles klar, merci für dini rückmeldung.",True,False
"jo, ich bi scho wieder enttäuscht eifach müehsam mach s guet",jo ich bi scho wieder enttaeuscht eifach mueehsam mach s guet,negativ,beschwerde,"Das tönt würklich müehsam. Erzähl gern no chli meh, was genau di stört.",True,False
"ich lueg viel series, wenn ich abends am abchille bi gruessli",ich lueg viel series wenn ich abends am abchille bi gruessli,neutral,hobby_talk,"Klingt spannend. Erzähl gern no meh über dini hobbys, wenn du lusch hesch.",True,False
ich bi komplett müed,ich bi komplett mueed,negativ,frust,"Ich verstand, dass dich das nervt. Was isch im Momänt am müehsamste für dich?",True,False
"ich bi froh, dass ich das chli hinter mir han",ich bi froh dass ich das chli hinter mir han,positiv,erleichterung,"Guet z ghöre, dass s sich jetzt leichter aafühlt. Was hät dir am meiste gholfe?",True,True
"hey, ich ha angst, dass es öppis ernsthafts isch",hey ich ha angst dass es oeppis ernsthafts isch,negativ,gesundheit_sorge,Gsundheitssorgä nimmt mer sich zu herz. Was macht dir im momänt am meiste sorge?,True,False
"ich ha s gfuehl, ich bin nöd guet gnue",ich ha s gfuehl ich bi ned guet gnue,negativ,selbstzweifel,"Es isch okay, wenn mer sich mal unsicher fühlt. Worin hesch du grad am meiste zweifel?",True,True
"hallo du, wo wäre für dich am praktischste?",hallo du wo waere fuer dich am praktischste,neutral,orga,"Klingt guet. Säg eifach, was dir am beschte passt, denn chömer s so abmache.",True,False
"ich chan s fast nöd glaube, wie guet das cho isch mega guet",ich chan s fast ned glaube wie guet das cho isch mega guet,positiv,freud,"Mega schön, dass dich das so freut. Erzähl gern no meh drüber, wenn du wotsch.",True,False
mini müeh hät sich würkli glohnt,mini mueeh haet sich wuerkli glohnt,positiv,erfolg,"Gratuliere, das isch en schöne erfolg. Nimm dir ruhig en moment, zum stolz z sii.",True,False
wie lang hesch du ungefäär zit? denke ich,wie lang hesch du ungefaeaer zit denke ich,neutral,orga,"Klingt guet. Säg eifach, was dir am beschte passt, denn chömer s so abmache.",True,False
"sali, ich mach mer sorgä um mini gsundheit zum d wand ufe laufä",sali ich mach mer sorgae um mini gsundheit zum d wand ufe laufae,negativ,gesundheit_sorge,Gsundheitssorgä nimmt mer sich zu herz. Was macht dir im momänt am meiste sorge?,True,False
"ich ha richtig lust, öppis azpacke",ich ha richtig lust oeppis azpacke,positiv,motivation,Das tönt nach vill energie. Wie wotsch die motivation für dich nutze?,True,False
"hoi, ich ha angst, alles nur z versaurä",hoi ich ha angst alles nur z versaurae,negativ,selbstzweifel,"Es isch okay, wenn mer sich mal unsicher fühlt. Worin hesch du grad am meiste zweifel?",True,False
"hoi, ich ha s gfuehl, ich zieh mi immer meh zrugg",hoi ich ha s gfuehl ich zieh mi immer meh zrugg,negativ,einsamkeit,"Sich einsam fühle isch nöd eifach. Schön, dass du drüber redsch. Wie fült sich das grad a für dich?",True,False
ich ha null motivation schönä tag no,ich ha null motivation schoenae tag no,negativ,frust,"Ich verstand, dass dich das nervt. Was isch im Momänt am müehsamste für dich?",True,False
chan mir bitte öpper s erkläre? ich chum nöd drus,chan mir bitte oepper s erklaere ich chum ned drus,negativ,hilfe_bitten,"Ich probier gern z helfe. Sag eifach, wo du grad hängsch.",True,False
ich bi grad voll im loch,ich bi grad voll im loch,negativ,frust,"Ich verstand, dass dich das nervt. Was isch im Momänt am müehsamste für dich?",True,True
ich ha sehr vil i die beziehig investiert und wenig zrugg übercho,ich ha sehr vil i die beziehig investiert und wenig zrugg uebercho,negativ,enttäuschung_beziehung,"Enttäuschige tue weh. Wenn du wotsch, chasch chli erläutere, was passiert isch.",True,False
s chummt immer no öppis debi und nüt wird weniger,s chummt immer no oeppis debi und nuet wird weniger,negativ,stress_alltag,"Alltag cha schnell z vil wärde. Womit fangemer am beschte aa, zum s chli z ordne?",True,True
ich bi dir würkli dankbar,ich bi dir wuerkli dankbar,positiv,dank,"Sehr gärn. Freut mi, wenn es dir öppis bringt.",True,False
"ich bin begeistert, wie sich das entwicklet het vo härze her guet",ich bi begeistert wie sich das entwicklet het vo haerze her guet,positiv,freud,"Mega schön, dass dich das so freut. Erzähl gern no meh drüber, wenn du wotsch.",True,False
"ich bi no nöd dort, wo ich wott sii, aber ufem weg wür ich säge",ich bi no ned dort wo ich wott sii aber ufem weg wuer ich saege,neutral,status_update,"Merci fürs update. Wenn sich öppis ändert, chasch eifach wieder schriebe.",True,False
keim nimmt das richtig ernst richtig müehsam schönä tag no,keim nimmt das richtig ernst richtig mueehsam schoenae tag no,negativ,beschwerde,"Das tönt würklich müehsam. Erzähl gern no chli meh, was genau di stört.",True,False
ich freu mi so fescht drüber,ich freu mi so fescht drueber,positiv,freud,"Mega schön, dass dich das so freut. Erzähl gern no meh drüber, wenn du wotsch.",True,False
"ey, jedä tag fängt scho gestresst a",ey jedae tag faengt scho gestresst a,negativ,stress_alltag,"Alltag cha schnell z vil wärde. Womit fangemer am beschte aa, zum s chli z ordne?",True,False
"hey, ich cha uf das resultat ohni schlechts gfühl luege zum dankbar sii",hey ich chan uf das resultat ohni schlechts gfuehl luege zum dankbar sii,positiv,stolz,Du darfsch stolz sii uf dich. Was gfallt dir selber am beschte a dim weg bis da?,True,False
"mir händ so vil glacht, das het richtig solid ta",mir haend so vil glacht das het richtig solid ta,positiv,verbindung_freunde,"Schön, dass du so mensche um dich hesch. Solchi momänt tue mega guet.",True,False
"bis jetzt isch no nüt eskaliert, es lauft ruhig",bis jetzt isch no nuet eskaliert es lauft ruhig,neutral,status_update,"Merci fürs update. Wenn sich öppis ändert, chasch eifach wieder schriebe.",True,True
"chan ich das nacher no ändere, falls nötig? so im fall",chan ich das nacher no aendere falls noetig so im fall,neutral,frage_info,Gueti frog. Ich versuech s dir möglichst eifach z erläuterä.,True,False
"ich hab e richtig guets gfühl für das, was chunt eifach nur schön",ich hab e richtig guets gfuehl fuer das was chunnt eifach nur schoen,positiv,vorfreude,Vorfreud isch öppis Schöns. Uf was freusch di am meiste?,True,False
"ich ha s gfuehl, ich bedeut nöd meh so vil wie früher",ich ha s gfuehl ich bedeut ned meh so vil wie frueher,negativ,enttäuschung_beziehung,"Enttäuschige tue weh. Wenn du wotsch, chasch chli erläutere, was passiert isch.",True,False
ich ha hart drfür gschaffet und jetzt zahlts sich us,ich ha hart drfuer gschaffet und jetzt zahlts sich us,positiv,stolz,Du darfsch stolz sii uf dich. Was gfallt dir selber am beschte a dim weg bis da?,True,True
ich bi mega froh um mini fründschaftä eifach nur schön mach s guet,ich bi mega froh um mini fruendschaftae eifach nur schoen mach s guet,positiv,verbindung_freunde,"Schön, dass du so mensche um dich hesch. Solchi momänt tue mega guet.",True,False
"hey, ich ha s gfuehl, ich cha zurecht chli stolz sii richtig lässig",hey ich ha s gfuehl ich chan zurecht chli stolz sii richtig laessig,positiv,stolz,Du darfsch stolz sii uf dich. Was gfallt dir selber am beschte a dim weg bis da?,True,False
"ich versteh s nöd ganz, chasch s no mal erläuterä? gopfriedstutz gruessli",ich versteh s ned ganz chasch s no mal erlaeuterae gopfriedstutz gruessli,negativ,hilfe_bitten,"Ich probier gern z helfe. Sag eifach, wo du grad hängsch.",True,False
"ich ha s gfuehl, ich werd nöd würklich glosä zum verseckä",ich ha s gfuehl ich werd ned wuerklich glosae zum verseckae,negativ,enttäuschung_beziehung,"Enttäuschige tue weh. Wenn du wotsch, chasch chli erläutere, was passiert isch.",True,False
"ich ha s gfühl, ich gang im job langsam unter lg",ich ha s gfuehl ich go im job langsam unter lg,negativ,überforderung_job,Jobstress cha würklich belaste. Was belastet di im momänt am stärkschte?,True,False
mues ich dafür öppis speziells vorbereite?,mues ich dafuer oeppis speziells vorbereite,neutral,frage_info,Gueti frog. Ich versuech s dir möglichst eifach z erläuterä.,True,False
ich bi emotional am limit,ich bi emotional am limit,negativ,frust,"Ich verstand, dass dich das nervt. Was isch im Momänt am müehsamste für dich?",True,True
"ich bin begeistert, wie sich das entwicklet het",ich bi begeistert wie sich das entwicklet het,positiv,freud,"Mega schön, dass dich das so freut. Erzähl gern no meh drüber, wenn du wotsch.",True,True
"ich bin begeistert, wie sich das entwicklet het",ich bi begeistert wie sich das entwicklet het,positiv,freud,"Mega schön, dass dich das so freut. Erzähl gern no meh drüber, wenn du wotsch.",True,False
ich freu mi huere uf d feriä,ich freu mi huere uf d feriae,positiv,vorfreude,Vorfreud isch öppis Schöns. Uf was freusch di am meiste?,True,False
"vo mir us es nüchternes, aber positives feedback so im fall",vo mir us es nuechternes aber positives feedback so im fall,neutral,feedback_sachlich,"Danke fürs sachlich feedback. Das hilft, s besser iigschätze z chönne.",True,False
ich bi imfall im momänt recht zfriede mit mim alltag,ich bi im fall im momaent recht zfriede mit mim alltag,positiv,zufriedenheit_alltag,"Schön, dass sich dis läbe im momänt stimmig aafühlt. Was wotsch gern so biibe lah?",True,True
ich find s weder mega lässig no mega schlecht,ich find s weder mega laessig no mega schlecht,neutral,sonstiges,"Alles klar, merci für dini rückmeldung.",True,False
ich ha e gueti balans zwüsche pause und leistung gfunde schöns wucheend,ich ha e gueti balans zwuesche pause und leistung gfunde schoens wucheend,positiv,zufriedenheit_alltag,"Schön, dass sich dis läbe im momänt stimmig aafühlt. Was wotsch gern so biibe lah?",True,False
"ich finds sachlich eigentlich guet umgsetzt, d struktur isch logisch so im fall",ich finds sachlich eigentlich guet umgsetzt d struktur isch logisch so im fall,neutral,feedback_sachlich,"Danke fürs sachlich feedback. Das hilft, s besser iigschätze z chönne.",True,False
"ich überleg mer, wie s die nächschte jahr sött usegseh passt so für mich",ich ueberleg mer wie s die naechschte jahr soett usegseh passt so fuer mich,neutral,planung_langfristig,"Okay, denn chömer gern zäme luege, wie mer das langfristig cha aagle.",True,False
"hoi, es isch alles so schlecht organisiert",hoi es isch alles so schlecht organisiert,negativ,beschwerde,"Das tönt würklich müehsam. Erzähl gern no chli meh, was genau di stört.",True,False
ich freu mi mega uf d feriä,ich freu mi mega uf d feriae,positiv,vorfreude,Vorfreud isch öppis Schöns. Uf was freusch di am meiste?,True,True
ich ha langsam kei nerv meh für dä scheiss bis bald,ich ha langsam kei nerv meh fuer dae scheiss bis bald,negativ,beschwerde,"Das tönt würklich müehsam. Erzähl gern no chli meh, was genau di stört.",True,False
"ich han vil kontakt online, aber weni, wo sich echt aafühlt bis bald",ich han vil kontakt online aber weni wo sich echt aafuehlt bis bald,negativ,einsamkeit,"Sich einsam fühle isch nöd eifach. Schön, dass du drüber redsch. Wie fült sich das grad a für dich?",True,False
wo wäre für dich am praktischste?,wo waere fuer dich am praktischste,neutral,orga,"Klingt guet. Säg eifach, was dir am beschte passt, denn chömer s so abmache.",True,False
"ich bin am luege, wie sich jobb und privat chönd verbinde lah mal gseh",ich bi am luege wie sich jobb und privat choend verbinde lah mal gseh,neutral,planung_langfristig,"Okay, denn chömer gern zäme luege, wie mer das langfristig cha aagle.",True,False
"hey, so wichtig isch s im momänt nöd mached mer so imfall",hey so wichtig isch s im momaent ned mached mer so im fall,neutral,sonstiges,"Alles klar, merci für dini rückmeldung.",True,False
"ey, ich bi emotional am limit zum schreiä bis bald",ey ich bi emotional am limit zum schreiae bis bald,negativ,frust,"Ich verstand, dass dich das nervt. Was isch im Momänt am müehsamste für dich?",True,False
"ich ha s gfühl, ich bi nöd alei mit mine themä bis spöter",ich ha s gfuehl ich bi ned alei mit mine themae bis spoeter,positiv,verbindung_freunde,"Schön, dass du so mensche um dich hesch. Solchi momänt tue mega guet.",True,False
"jo, ich ha ständig müedigkeit und kenn de grund nöd",jo ich ha staendig mueedigkeit und kenn de grund ned,negativ,gesundheit_sorge,Gsundheitssorgä nimmt mer sich zu herz. Was macht dir im momänt am meiste sorge?,True,False
"ich ha min weg gmacht, Schritt für Schritt",ich ha min weg gmacht schritt fuer schritt,positiv,stolz,Du darfsch stolz sii uf dich. Was gfallt dir selber am beschte a dim weg bis da?,True,True
"ich ha s gfuehl, mis handy isch extrem langsam worde",ich ha s gfuehl mis handy isch extrem langsam worde,neutral,technik_support,"Okay, luegemer zäme druf. Was genau funktioniert im momänt nöd so, wie s sött?",True,False
"ich weiss nöd, wie lang ich das no cha",ich weiss noed wie lang ich das no chan,negativ,frust,"Ich verstand, dass dich das nervt. Was isch im Momänt am müehsamste für dich?",True,True
ich ha en guete drive im momänt,ich ha en guete drive im momaent,positiv,motivation,Das tönt nach vill energie. Wie wotsch die motivation für dich nutze?,True,False
"ich weiss nöd, wie ich mit dem umgah söll gopfertami bis spöter",ich weiss noed wie ich mit dem umgah soell gopfertami bis spoeter,negativ,konflikt,Konflikt sind nöd eifach. Was isch dir da besonders wichtig i dä situation?,True,False
"ich ha s gfuehl, ich werd nöd würkli wahrgnuu",ich ha s gfuehl ich werd ned wuerkli wahrgnuu,negativ,selbstzweifel,"Es isch okay, wenn mer sich mal unsicher fühlt. Worin hesch du grad am meiste zweifel?",True,False
"ey, mues ich dafür öppis speziells vorbereite? für s erscht mal guet",ey mues ich dafuer oeppis speziells vorbereite fuer s erscht mal guet,neutral,frage_info,Gueti frog. Ich versuech s dir möglichst eifach z erläuterä.,True,False
"hallo du, ich find dini lösig sehr geschickt lg",hallo du ich find dini loesig sehr geschickt lg,positiv,lob,"Schön z ghöre, dass das so guet cho isch. Mach eifach so wiiter.",True,False
für wann sömer s ungefähr apegge?,fuer wann soemer s ungefaehr apegge,neutral,orga,"Klingt guet. Säg eifach, was dir am beschte passt, denn chömer s so abmache.",True,False
"ich bin stolz, dass ich mini werte nöd verloo ha",ich bi stolz dass ich mini werte ned verloo ha,positiv,stolz,Du darfsch stolz sii uf dich. Was gfallt dir selber am beschte a dim weg bis da?,True,False
"hey, was treibsch im momänt? schöns wucheend",hey was treibsch im momaent schoens wucheend,neutral,smalltalk,"Mir gohts guet, merci. Und dir so im alltag?",True,False
"imfall, es git jetzt es neus feature bi dere app",imfall es git jetzt es neus feature bi dere app,neutral,news_teilen,"Danke fürs teile. Spannend, was grad alles lauft.",True,True
"ich ha s gfühl, ich ha mini säch im griff",ich ha s gfuehl ich ha mini saech im griff,positiv,zufriedenheit_alltag,"Schön, dass sich dis läbe im momänt stimmig aafühlt. Was wotsch gern so biibe lah?",True,False
"gits öppis, wo ich im vorus sött wüsse?",gits oeppis wo ich im vorus soett wuesse,neutral,frage_info,Gueti frog. Ich versuech s dir möglichst eifach z erläuterä.,True,True
"ich weiss nöd, wie ich aafange söll",ich weiss noed wie ich aafange soell,negativ,hilfe_bitten,"Ich probier gern z helfe. Sag eifach, wo du grad hängsch.",True,True
jedä tag fängt scho gestresst a gopfertami,jedae tag faengt scho gestresst a gopfertami,negativ,stress_alltag,"Alltag cha schnell z vil wärde. Womit fangemer am beschte aa, zum s chli z ordne?",True,False
"ich mues no uussortiere, was mir würkli wichtig isch uf d längi",ich mues no uussortiere was mir wuerkli wichtig isch uf d laengi,neutral,planung_langfristig,"Okay, denn chömer gern zäme luege, wie mer das langfristig cha aagle.",True,False
wie lang gaht das ungefäär?,wie lang gaht das ungefaeaer,neutral,frage_info,Gueti frog. Ich versuech s dir möglichst eifach z erläuterä.,True,True
jedä tag fängt scho gestresst a,jedae tag faengt scho gestresst a,negativ,stress_alltag,"Alltag cha schnell z vil wärde. Womit fangemer am beschte aa, zum s chli z ordne?",True,True
"ich bi froh, dass ich das chli hinter mir han",ich bi froh dass ich das chli hinter mir han,positiv,erleichterung,"Guet z ghöre, dass s sich jetzt leichter aafühlt. Was hät dir am meiste gholfe?",True,False
"ich bi froh, dass sich das nöd so schlimm entwicklet het",ich bi froh dass sich das ned so schlimm entwicklet het,positiv,erleichterung,"Guet z ghöre, dass s sich jetzt leichter aafühlt. Was hät dir am meiste gholfe?",True,False
"ich ha s gfühl, ich gang im job langsam unter zum schreiä",ich ha s gfuehl ich go im job langsam unter zum schreiae,negativ,überforderung_job,Jobstress cha würklich belaste. Was belastet di im momänt am stärkschte?,True,False
"hoi, ich bi gern drausse underwägs, wenn s wätter mitmacht",hoi ich bi gern drausse underwaegs wenn s waetter mitmacht,neutral,hobby_talk,"Klingt spannend. Erzähl gern no meh über dini hobbys, wenn du lusch hesch.",True,False
"jo, ich ha wieder aagfange meh z läse",jo ich ha wieder aagfange meh z laese,neutral,hobby_talk,"Klingt spannend. Erzähl gern no meh über dini hobbys, wenn du lusch hesch.",True,False
ich ha s vertroue chli verlore mach s guet,ich ha s vertroue chli verlore mach s guet,negativ,enttäuschung_beziehung,"Enttäuschige tue weh. Wenn du wotsch, chasch chli erläutere, was passiert isch.",True,False
"ich bi gern drausse underwägs, wenn s wätter mitmacht mal gseh",ich bi gern drausse underwaegs wenn s waetter mitmacht mal gseh,neutral,hobby_talk,"Klingt spannend. Erzähl gern no meh über dini hobbys, wenn du lusch hesch.",True,False
i bi am abig eifach komplett dure so en käse,i bi am abig eifach komplett dure so en kaese,negativ,stress_alltag,"Alltag cha schnell z vil wärde. Womit fangemer am beschte aa, zum s chli z ordne?",True,False
"jo, wänn söll ich dir d details schicke? liebi grüess",jo waenn soell ich dir d details schicke liebi grueess,neutral,orga,"Klingt guet. Säg eifach, was dir am beschte passt, denn chömer s so abmache.",True,False
für wann sömer s ungefähr apegge?,fuer wann soemer s ungefaehr apegge,neutral,orga,"Klingt guet. Säg eifach, was dir am beschte passt, denn chömer s so abmache.",True,False
"ich denk grad vil drüber nach, was ich langfristig wott schönä tag no",ich denk grad vil drueber nach was ich langfristig wott schoenae tag no,neutral,planung_langfristig,"Okay, denn chömer gern zäme luege, wie mer das langfristig cha aagle.",True,False
ich versueche grad mini längfristige plän z ordne lg,ich versueche grad mini laengfristige plaen z ordne lg,neutral,planung_langfristig,"Okay, denn chömer gern zäme luege, wie mer das langfristig cha aagle.",True,False
"hallo du, ich find s weder mega guet no mega schlecht schöns wucheend",hallo du ich find s weder mega guet no mega schlecht schoens wucheend,neutral,sonstiges,"Alles klar, merci für dini rückmeldung.",True,False
"merci viu mau, das isch mega lieb vo dir eifach stark schöns wucheend",merci viu mau das isch mega lieb vo dir eifach stark schoens wucheend,positiv,dank,"Sehr gärn. Freut mi, wenn es dir öppis bringt.",True,False
mir händ en extrem gmüetliche abig gha zäme,mir haend en extrem gmueetliche abig gha zaeme,positiv,verbindung_freunde,"Schön, dass du so mensche um dich hesch. Solchi momänt tue mega guet.",True,True
"ich bi stolz, dass ich drblibe bi, au wenn s schwierig gsi isch mega guet",ich bi stolz dass ich drblibe bi au wenn s schwierig gsi isch mega guet,positiv,stolz,Du darfsch stolz sii uf dich. Was gfallt dir selber am beschte a dim weg bis da?,True,False
"ich bi über en beitrag gstolpert, wo guet z dem passt",ich bi ueber en beitrag gstolpert wo guet z dem passt,neutral,news_teilen,"Danke fürs teile. Spannend, was grad alles lauft.",True,False
"ey, ich bi mega happy grad mach s guet",ey ich bi mega happy grad mach s guet,positiv,freud,"Mega schön, dass dich das so freut. Erzähl gern no meh drüber, wenn du wotsch.",True,False
"hoi, ich bi grad wieder vil am gamä i minere freizit",hoi ich bi grad wieder vil am gamae i minere freizit,neutral,hobby_talk,"Klingt spannend. Erzähl gern no meh über dini hobbys, wenn du lusch hesch.",True,False
ich freu mi sogar uf d nägschti aufgabä,ich freu mi sogar uf d naegschti aufgabae,positiv,motivation,Das tönt nach vill energie. Wie wotsch die motivation für dich nutze?,True,False
"ey, das isch richtig stark worde",ey das isch richtig stark worde,positiv,lob,"Schön z ghöre, dass das so guet cho isch. Mach eifach so wiiter.",True,False
"es isch schön z gseh, wie wiit ich cho bi",es isch schoen z gseh wie wiit ich cho bi,positiv,stolz,Du darfsch stolz sii uf dich. Was gfallt dir selber am beschte a dim weg bis da?,True,True
"sali, ich bi im moment voll im kochfilm",sali ich bi im moment voll im kochfilm,neutral,hobby_talk,"Klingt spannend. Erzähl gern no meh über dini hobbys, wenn du lusch hesch.",True,False
d abmachige werdet nie ihalte,d abmachige werdet nie ihalte,negativ,beschwerde,"Das tönt würklich müehsam. Erzähl gern no chli meh, was genau di stört.",True,False
es muess nöd grad hüt sii chömer so lah ciao,es muess ned grad huet sii choemer so lah ciao,neutral,sonstiges,"Alles klar, merci für dini rückmeldung.",True,False
"chasch mir kurz erkläre, was ich mues mache?",chasch mir kurz erklaere was ich mues mache,neutral,frage_info,Gueti frog. Ich versuech s dir möglichst eifach z erläuterä.,True,False
"merci, dass du dir d zit gnoh hesch",merci dass du dir d zit gnoh hesch,positiv,dank,"Sehr gärn. Freut mi, wenn es dir öppis bringt.",True,True
