text,label,intent,is_seed,text_clean
"huere guets gfühl, dass s am end funktioniert het",positiv,erleichterung,True,huere guets gfuehl dass s am end funktioniert het
"het richtig entspannt, dass d sache jetzt klar sind",positiv,erleichterung,True,het richtig entspannt dass d sache jetzt klar sind
"so lang druf gwartet – und jetz isch s vom tisch, mega",positiv,erleichterung,True,so lang druf gwartet und jetz isch s vom tisch mega
"bin erleichtert, dass mini einschätzig nöd falsch gsi isch",positiv,erleichterung,True,bi erleichtert dass mini einschaetzig ned falsch gsi isch
"ha viel drüber grüeblet, aber jetzt passt s für mich",positiv,erleichterung,True,ha viel drueber grueeblet aber jetzt passt s fuer mich
"d entscheidig het guet ta, fühl mi leichter",positiv,erleichterung,True,d entscheidig het guet ta fuehl mi leichter
"erleichteret gseh, dass ich nüt verschlimmert ha",positiv,erleichterung,True,erleichteret gseh dass ich nuet verschlimmert ha
ha wieder ruiger nacht gha – es tuet guet,positiv,erleichterung,True,ha wieder ruiger nacht gha es tuet guet
"so schön, das chli hinter mir z wüsse",positiv,erleichterung,True,so schoen das chli hinter mir z wuesse
mini lascht fühlt sich definitiv lichter a,positiv,erleichterung,True,mini lascht fuehlt sich definitiv lichter a
"froh, wie guet s am schluss usecho isch",positiv,erleichterung,True,froh wie guet s am schluss usecho isch
"schön z merke, dass ich s nöd komplett falsch verstande ha",positiv,erleichterung,True,schoen z merke dass ich s ned komplett falsch verstande ha
"het richtig entspannt, wieder chli ruhe z ha",positiv,erleichterung,True,het richtig entspannt wieder chli ruhe z ha
"froh, dass s friedlich und ohne drama bliibe isch",positiv,erleichterung,True,froh dass s friedlich und ohne drama bliibe isch
"erleichtert, dass s nöd i falschi richtung gange isch",positiv,erleichterung,True,erleichtert dass s ned i falschi richtung gange isch
dä druck im chopf isch endlich wäg,positiv,erleichterung,True,dae druck im chopf isch endlich waeg
"ha s gfühl, ich ha wieder stabilität under de füess",positiv,erleichterung,True,ha s gfuehl ich ha wieder stabilitaet under de fueess
"truurig wär s gsi, aber bin froh, dass ich nöd alei bim themä bi",positiv,erleichterung,True,truurig waer s gsi aber bi froh dass ich ned alei bim themae bi
"bin erleichtert, dass sich mini sorgä nöd bestätigt händ",positiv,erleichterung,True,bi erleichtert dass sich mini sorgae ned bestaetigt haend
"mega happy über d lösig, wo ich gfunde ha",positiv,erleichterung,True,mega happy ueber d loesig wo ich gfunde ha
endlich chani s theama abhäkeln und loslah,positiv,erleichterung,True,endlich chani s theama abhaekeln und loslah
"han s gfühl, ich chan wieder normal schnufe",positiv,erleichterung,True,han s gfuehl ich chan wieder normal schnufe
d erlöserig über dä positive usgang isch riesig,positiv,erleichterung,True,d erloeserig ueber dae positive usgang isch riesig
"het richtig guet ta, z merke, wie stolz ich chan sii",positiv,stolz,True,het richtig guet ta z merke wie stolz ich chan sii
"ha öppis gstemt, wo ich mir lang nöd zuegtraut ha",positiv,stolz,True,ha oeppis gstemt wo ich mir lang ned zuegtraut ha
"schön z gseh, wie wiit ich i dere zit cho bi",positiv,stolz,True,schoen z gseh wie wiit ich i dere zit cho bi
"fühlt sich richtig an, stolz uf mis leiste z sii",positiv,stolz,True,fuehlt sich richtig an stolz uf mis leiste z sii
ha hart drfür gschaffet – und s het sich voll glohnt,positiv,stolz,True,ha hart drfuer gschaffet und s het sich voll glohnt
bi ehrlich zfriede mit minere performance,positiv,stolz,True,bi ehrlich zfriede mit minere performance
"bin stolz, dass ich drblibe bi, au wenn s streng gsi isch",positiv,stolz,True,bi stolz dass ich drblibe bi au wenn s streng gsi isch
han mini eigete erwartige sogar übertroffe,positiv,stolz,True,han mini eigete erwartige sogar uebertroffe
uf das resultat chan ich würkli mit stolz luege,positiv,stolz,True,uf das resultat chan ich wuerkli mit stolz luege
"stolz, wie ruhig und überlegt ich reagiert ha",positiv,stolz,True,stolz wie ruhig und ueberlegt ich reagiert ha
"huere schön, dass ich mini werte bewahrt ha",positiv,stolz,True,huere schoen dass ich mini werte bewahrt ha
mini komfortzone verlasse und trotzdem erfolg gha – mega!,positiv,stolz,True,mini komfortzone verlasse und trotzdem erfolg gha mega
cha stolz sii uf jedes chliini schrittli,positiv,stolz,True,chan stolz sii uf jedes chliini schrittli
"finds echt cool, dass ich dr schnauf gha ha zum drbliibe",positiv,stolz,True,finds echt cool dass ich dr schnauf gha ha zum drbliibe
"bi vo mir selber beidrukt, wie ich das packt ha",positiv,stolz,True,bi vo mir selber beidrukt wie ich das packt ha
"stolz drauf, dass ich mich nöd ha verunsichere lah",positiv,stolz,True,stolz drauf dass ich mich ned ha verunsichere lah
cha ohne scheu säge: ich bi stolz uf mich,positiv,stolz,True,chan ohne scheu saege ich bi stolz uf mich
"bin stolz, dass ich s würkli durchzieh ha",positiv,stolz,True,bi stolz dass ich s wuerkli durchzieh ha
merks richtig: mini entwicklung goht vorwärts,positiv,stolz,True,merks richtig mini entwicklung goht vorwaerts
der erfolg het mir e chli schub geh,positiv,stolz,True,der erfolg het mir e chli schub go
"bin stolz, wie viel ich gelernt ha i dere phase",positiv,stolz,True,bi stolz wie viel ich gelernt ha i dere phase
"stolz, dass ich verantwortig übernoh ha und guet damit umgange bi",positiv,stolz,True,stolz dass ich verantwortig uebernoh ha und guet damit umgange bi
"cool z merke, dass ich mini gränze akzeptiere cha",positiv,stolz,True,cool z merke dass ich mini graenze akzeptiere chan
"freu mi, wie vill ich us frühere fehler mitgnoh ha",positiv,stolz,True,freu mi wie vill ich us fruehere fehler mitgnoh ha
mini disziplin het sich würkli uszahlt – stolz!,positiv,stolz,True,mini disziplin het sich wuerkli uszahlt stolz
"es gfühl vo stolz, wie ich das gmeistert ha",positiv,stolz,True,es gfuehl vo stolz wie ich das gmeistert ha
"ha endlich s gfühl, ich cha öppis bewirke",positiv,stolz,True,ha endlich s gfuehl ich chan oeppis bewirke
"finds cool, dass ich mi nöd ha stressä lah",positiv,stolz,True,finds cool dass ich mi ned ha stressae lah
mini ziele verfolge und drbi bliibe – das macht mi stolz,positiv,stolz,True,mini ziele verfolge und drbi bliibe das macht mi stolz
"füühlt sich guet a, dass ich i d richtige richtung underwägs bi",positiv,stolz,True,fueuehlt sich guet a dass ich i d richtige richtung underwaegs bi
"dä abig isch imfall mega gmüetlich gsi, het richtig guet ta",positiv,verbindung_freunde,True,dae abig isch im fall mega gmueetlich gsi het richtig guet ta
"so froh, so ehrligi fründschaft im läbe z ha",positiv,verbindung_freunde,True,so froh so ehrligi fruendschaft im laebe z ha
mir händ so viel glacht – pure energie,positiv,verbindung_freunde,True,mir haend so viel glacht pure energie
"het sich mega schön aagfühlt, wie ufgnoh ich mi i dere gruppe gfühlt ha",positiv,verbindung_freunde,True,het sich mega schoen aagfuehlt wie ufgnoh ich mi i dere gruppe gfuehlt ha
"mer merkt richtig, wie mir üs immer besser verstöhnd",positiv,verbindung_freunde,True,mer merkt richtig wie mir ues immer besser verstoehnd
"het guet ta, au über ernsti sache chönne rede",positiv,verbindung_freunde,True,het guet ta au ueber ernsti sache choenne rede
"ich schätz so mensche extrem, wo ehrlich und warm sind",positiv,verbindung_freunde,True,ich schaetz so mensche extrem wo ehrlich und warm sind
lang nüm so es offes und ehrlechs gspröch gha,positiv,verbindung_freunde,True,lang nuem so es offes und ehrlechs gsproech gha
für die nächi unter fründe bin ich mega dankbar,positiv,verbindung_freunde,True,fuer die naechi unter fruende bi ich mega dankbar
"so schöns gfühl, nöd alei mit mine themä z sii",positiv,verbindung_freunde,True,so schoens gfuehl ned alei mit mine themae z sii
dä gemeinsame moment isch würkli schön gsi,positiv,verbindung_freunde,True,dae gemeinsame moment isch wuerkli schoen gsi
verlässligi fründe wie ihr sind gold wert,positiv,verbindung_freunde,True,verlaessligi fruende wie ihr sind gold wert
d gemeinsami zit tuet mir jeweils extrem guet,positiv,verbindung_freunde,True,d gemeinsami zit tuet mir jeweils extrem guet
"isch schön, eifach völlig sich sälber chöne sii dra",positiv,verbindung_freunde,True,isch schoen eifach voellig sich saelber choene sii dra
ha mi richtig wohl gfühlt bi üsem treffe,positiv,verbindung_freunde,True,ha mi richtig wohl gfuehlt bi uesem treffe
mini fründ gäh mir richtig viel halt im alltag,positiv,verbindung_freunde,True,mini fruend gaeh mir richtig viel halt im alltag
jede minute zäme isch wertvoll für mich,positiv,verbindung_freunde,True,jede minute zaeme isch wertvoll fuer mich
"fründ wo ehrlich blibed, sind für mich mega wichtig",positiv,verbindung_freunde,True,fruend wo ehrlich blibed sind fuer mich mega wichtig
"finds schön, wie offe und natürlich mir chönd rede",positiv,verbindung_freunde,True,finds schoen wie offe und natuerlich mir choend rede
mini fründe gäh mir grad voll energie,positiv,verbindung_freunde,True,mini fruende gaeh mir grad voll energie
"han wieder mol gmerkt, wie wichtig so fründschaft isch",positiv,verbindung_freunde,True,han wieder mol gmerkt wie wichtig so fruendschaft isch
fühl mi mega getragen vo üsem umfeld,positiv,verbindung_freunde,True,fuehl mi mega getragen vo uesem umfeld
dä vibe unter üs isch einfach angenehm und herzlich,positiv,verbindung_freunde,True,dae vibe unter ues isch einfach angenehm und herzlich
ha s treffe richtig wunderschön gfunde,positiv,verbindung_freunde,True,ha s treffe richtig wunderschoen gfunde
mini fründe bedeuted mir extrem viel,positiv,verbindung_freunde,True,mini fruende bedeuted mir extrem viel
bin dankbar für üsi gmeinschaft als team,positiv,verbindung_freunde,True,bi dankbar fuer uesi gmeinschaft als team
"würd sach, mini fründschaftä wärded vo jahr z jahr tiefer",positiv,verbindung_freunde,True,wuerd sach mini fruendschaftae waerded vo jahr z jahr tiefer
"het mir mega vill bedeutet, dä momänt z teile",positiv,verbindung_freunde,True,het mir mega vill bedeutet dae momaent z teile
"so guet, sich verstande und akzeptiert z wüsse",positiv,verbindung_freunde,True,so guet sich verstande und akzeptiert z wuesse
"fühlt sich schön a, so supportive fründe z ha",positiv,verbindung_freunde,True,fuehlt sich schoen a so supportive fruende z ha
grad voll dä drive i mir – würd am liebschte sofort loslegä,positiv,motivation,True,grad voll dae drive i mir wuerd am liebschte sofort loslegae
"so richtig bock, öppis aazpacke im momänt",positiv,motivation,True,so richtig bock oeppis aazpacke im momaent
energie pur – ich spürs richtig,positiv,motivation,True,energie pur ich spuers richtig
"fühlt sich a, als wär jetzt dä perfekte moment für öppis neus",positiv,motivation,True,fuehlt sich a als waer jetzt dae perfekte moment fuer oeppis neus
"es sprudlet nur so vo idee, möcht grad alles umsetze",positiv,motivation,True,es sprudlet nur so vo idee moecht grad alles umsetze
dä innere schwung isch mega präsent,positiv,motivation,True,dae innere schwung isch mega praesent
parat für die nächschte schritt – fühlt sich guet a,positiv,motivation,True,parat fuer die naechschte schritt fuehlt sich guet a
seh sogar freud i de kommende challenge,positiv,motivation,True,seh sogar freud i de kommende challenge
bin grad überraschend produktiv unterwegs,positiv,motivation,True,bi grad ueberraschend produktiv unterwegs
"ha s gfühl, ich cha grad güet bewege mit minere energie",positiv,motivation,True,ha s gfuehl ich chan grad gueet bewege mit minere energie
motiviert wie scho lang nüm – richtig angenehm,positiv,motivation,True,motiviert wie scho lang nuem richtig angenehm
schmöck förmlich erfolgsluft i de nöchi,positiv,motivation,True,schmoeck foermlich erfolgsluft i de noechi
bin voll konzentriert und im fokusmodus,positiv,motivation,True,bi voll konzentriert und im fokusmodus
dranzbliibe fällt mir grad mega eifach,positiv,motivation,True,dranzbliibe faellt mir grad mega eifach
"spür, dass gueti ideä parat stöhnd",positiv,motivation,True,spuer dass gueti ideae parat stoehnd
bin voll im flow – jede schritt fäut sich natürlich a,positiv,motivation,True,bi voll im flow jede schritt faeut sich natuerlich a
wär am liebschte grad direkt gstertet,positiv,motivation,True,waer am liebschte grad direkt gstertet
kraft und elan sind grad ufem maximum,positiv,motivation,True,kraft und elan sind grad ufem maximum
"hä richtig lust, öppis neus uuszprobe",positiv,motivation,True,hae richtig lust oeppis neus uuszprobe
"es gfühl, dass grad mega vil möglich isch",positiv,motivation,True,es gfuehl dass grad mega vil moeglich isch
"freu mi richtig uf s projekt, es kribbelt scho",positiv,motivation,True,freu mi richtig uf s projekt es kribbelt scho
bin mega driven und parat zum uusrisse,positiv,motivation,True,bi mega driven und parat zum uusrisse
"han im gfühl, es chunt öppis sehr positiivs use",positiv,motivation,True,han im gfuehl es chunnt oeppis sehr positiivs use
"fühl mi wach, klar und startbereit",positiv,motivation,True,fuehl mi wach klar und startbereit
han richtig en motivationsschub übercho,positiv,motivation,True,han richtig en motivationsschub uebercho
"bin mega inspiriert vo dem, was chönnt werde",positiv,motivation,True,bi mega inspiriert vo dem was choennt werde
energie für die ufgabe isch definitiv da,positiv,motivation,True,energie fuer die ufgabe isch definitiv da
voller elan – chönnt grad e stund durcharbe,positiv,motivation,True,voller elan choennt grad e stund durcharbe
"d vibes sind mega positiv, tut richtig guet",positiv,motivation,True,d vibes sind mega positiv tut richtig guet
"han wieder en richtig starke wille, öppis z erreiche",positiv,motivation,True,han wieder en richtig starke wille oeppis z erreiche
d vorfreud isch grad riesig – chan s kaum erwarte,positiv,vorfreude,True,d vorfreud isch grad riesig chan s kaum erwarte
"freu mi huere uf d feriä, wird sicher mega",positiv,vorfreude,True,freu mi huere uf d feriae wird sicher mega
"ha so freud uf dä termin, chönt jetzt scho sii",positiv,vorfreude,True,ha so freud uf dae termin choent jetzt scho sii
bin scho voll am plane und chum richtig i stimmig,positiv,vorfreude,True,bi scho voll am plane und chum richtig i stimmig
"ha e super gfühl für das, was bald chunt",positiv,vorfreude,True,ha e super gfuehl fuer das was bald chunnt
"zelle fascht jede tag, bis dä moment endlech do isch",positiv,vorfreude,True,zelle fascht jede tag bis dae moment endlech do isch
"freu mi enorm uf d lüt, wo ich wieder gseh",positiv,vorfreude,True,freu mi enorm uf d luet wo ich wieder gseh
ha lang druf gwartet – jetzt passiert s gli!,positiv,vorfreude,True,ha lang druf gwartet jetzt passiert s gli
"han s gfühl, das wird öppis richtig schöns",positiv,vorfreude,True,han s gfuehl das wird oeppis richtig schoens
mini vorfreud git mir voll energie,positiv,vorfreude,True,mini vorfreud git mir voll energie
"bi richtig hibbelig, jedes mol wenn ich dra denke",positiv,vorfreude,True,bi richtig hibbelig jedes mol wenn ich dra denke
"freu mi mega, dass bald öppis neus asteht",positiv,vorfreude,True,freu mi mega dass bald oeppis neus asteht
"chan s nüme so lang abwarte, ehrlich",positiv,vorfreude,True,chan s nueme so lang abwarte ehrlich
"voll bock uf das, was als nöchsts chunt",positiv,vorfreude,True,voll bock uf das was als noechsts chunnt
"es gfühl säit mir, dass das mega guet wird",positiv,vorfreude,True,es gfuehl saeit mir dass das mega guet wird
mini plän für di nöchschti zit mache mi voll glücklich,positiv,vorfreude,True,mini plaen fuer di noechschti zit mache mi voll gluecklich
würkli gspannt uf die nächschti wuche,positiv,vorfreude,True,wuerkli gspannt uf die naechschti wuche
"parat fürs abentüür, wo vor mir staht",positiv,vorfreude,True,parat fuers abentueuer wo vor mir staht
"freu mi uf öppis, wo mir richtig vil bedeutet",positiv,vorfreude,True,freu mi uf oeppis wo mir richtig vil bedeutet
"ha lang ufgfahre, und jetzt isch s bald sowiit",positiv,vorfreude,True,ha lang ufgfahre und jetzt isch s bald sowiit
spür richtig s kribbele vo vorfreud,positiv,vorfreude,True,spuer richtig s kribbele vo vorfreud
chan fasch nüm still hocke – so excited,positiv,vorfreude,True,chan fasch nuem still hocke so excited
"freu mi uf jede chliini minute vo dem, was chunt",positiv,vorfreude,True,freu mi uf jede chliini minute vo dem was chunnt
"ha mega freud, scho nur bim drübernohdenke",positiv,vorfreude,True,ha mega freud scho nur bim druebernohdenke
gseh dem tag richtig fröhlich entgegen,positiv,vorfreude,True,gseh dem tag richtig froehlich entgegen
"jedes mol wenn ich dra denke, chunnt en smile",positiv,vorfreude,True,jedes mol wenn ich dra denke chunnt en smile
"mached mich mega hyped, as chunt echt guets",positiv,vorfreude,True,mached mich mega hyped as chunnt echt guets
ha grad mega viel vorfreud uf das ganz projekt,positiv,vorfreude,True,ha grad mega viel vorfreud uf das ganz projekt
merks voll: das wird en richtig schöner moment,positiv,vorfreude,True,merks voll das wird en richtig schoener moment
"vorfreud isch so gross, chani fasch nüm abschalte",positiv,vorfreude,True,vorfreud isch so gross chani fasch nuem abschalte
grad e richtig angenehmi ruä im alltag – tuet mega guet,positiv,zufriedenheit_alltag,True,grad e richtig angenehmi ruae im alltag tuet mega guet
"nöd perfekt, aber s stimmt für mich und das reicht völlig",positiv,zufriedenheit_alltag,True,ned perfekt aber s stimmt fuer mich und das reicht voellig
d balans zwüsche arbeit und pause passt grad super,positiv,zufriedenheit_alltag,True,d balans zwuesche arbeit und pause passt grad super
"ha s gfühl, alles füegt sich im momänt guet zäme",positiv,zufriedenheit_alltag,True,ha s gfuehl alles fueegt sich im momaent guet zaeme
s tempo isch angenehm – chan guet damit läbe,positiv,zufriedenheit_alltag,True,s tempo isch angenehm chan guet damit laebe
mini tägliche routine git mir voll stabilität,positiv,zufriedenheit_alltag,True,mini taegliche routine git mir voll stabilitaet
"schön, mol kei drama umezha – richtig entspannt",positiv,zufriedenheit_alltag,True,schoen mol kei drama umezha richtig entspannt
fühl mi grad stabil und im griff mit allem,positiv,zufriedenheit_alltag,True,fuehl mi grad stabil und im griff mit allem
chan mer sogar öppis ruä gönne – selten aber schön,positiv,zufriedenheit_alltag,True,chan mer sogar oeppis ruae goenne selten aber schoen
"bin mega dankbar für die stabilität, wo grad da isch",positiv,zufriedenheit_alltag,True,bi mega dankbar fuer die stabilitaet wo grad da isch
entspannt und zfriede – gueti kombi,positiv,zufriedenheit_alltag,True,entspannt und zfriede gueti kombi
"froh um die ruhig phase, het richtig guet ta",positiv,zufriedenheit_alltag,True,froh um die ruhig phase het richtig guet ta
s fühlt sich grad wie en natürlecha flow a,positiv,zufriedenheit_alltag,True,s fuehlt sich grad wie en natuerlecha flow a
bin voll im einklang mit mim alltag,positiv,zufriedenheit_alltag,True,bi voll im einklang mit mim alltag
chan mich sogar über chliini sache freue – das macht vill uus,positiv,zufriedenheit_alltag,True,chan mich sogar ueber chliini sache freue das macht vill uus
"grounded und ruhig, eifach angenehm",positiv,zufriedenheit_alltag,True,grounded und ruhig eifach angenehm
"es isch schön, wie ausgegliiche alles wirkt",positiv,zufriedenheit_alltag,True,es isch schoen wie ausgegliiche alles wirkt
"mini routine isch schlicht, aber passt perfekt",positiv,zufriedenheit_alltag,True,mini routine isch schlicht aber passt perfekt
"bin sehr dankbar, dass s grad harmonisch lauft",positiv,zufriedenheit_alltag,True,bi sehr dankbar dass s grad harmonisch lauft
"nöd überforderet, nöd gelangweilt – genau dä sweet spot",positiv,zufriedenheit_alltag,True,ned ueberforderet ned gelangweilt genau dae sweet spot
"ha s gfühl, alles bewegt sich i enem gsunde rahme",positiv,zufriedenheit_alltag,True,ha s gfuehl alles bewegt sich i enem gsunde rahme
jede ruigi minute isch wie es chli gschenk,positiv,zufriedenheit_alltag,True,jede ruigi minute isch wie es chli gschenk
chan mich mit ruigem gfühl zruglehne,positiv,zufriedenheit_alltag,True,chan mich mit ruigem gfuehl zruglehne
s alltags-tempo stimmt – weder z schnell noch z langsam,positiv,zufriedenheit_alltag,True,s alltags tempo stimmt weder z schnell noch z langsam
fühl mich im einklang mit mir selber,positiv,zufriedenheit_alltag,True,fuehl mich im einklang mit mir selber
"schön, dass ich grad nöd hetze mues",positiv,zufriedenheit_alltag,True,schoen dass ich grad ned hetze mues
"stabil, entspannt und gut unterwegs",positiv,zufriedenheit_alltag,True,stabil entspannt und gut unterwegs
chan s läbe grad eifach chli gniesse,positiv,zufriedenheit_alltag,True,chan s laebe grad eifach chli gniesse
bin sehr zfriede mit mim rhythmus,positiv,zufriedenheit_alltag,True,bi sehr zfriede mit mim rhythmus
"ha s gfühl, ich bi grad am richtige ort im läbe",positiv,zufriedenheit_alltag,True,ha s gfuehl ich bi grad am richtige ort im laebe
"hey, wie lauft s so bi dir hüt?",neutral,smalltalk,True,hey wie lauft s so bi dir huet
"hoi zäme, alles locker im momänt?",neutral,smalltalk,True,hoi zaeme alles locker im momaent
"na, wie goht s dir grad?",neutral,smalltalk,True,na wie goht s dir grad
wie isch dini wuche bis jetzt so cho?,neutral,smalltalk,True,wie isch dini wuche bis jetzt so cho
bisch guet i de tag gstarrt?,neutral,smalltalk,True,bisch guet i de tag gstarrt
was treibsch aktuell so ume?,neutral,smalltalk,True,was treibsch aktuell so ume
lange nüm gseh – wie gaht s?,neutral,smalltalk,True,lange nuem gseh wie gaht s
was machsch imfall grad so?,neutral,smalltalk,True,was machsch im fall grad so
wie hesch s gister so gha?,neutral,smalltalk,True,wie hesch s gister so gha
"alles okay bi dir, grundsätzlich?",neutral,smalltalk,True,alles okay bi dir grundsaetzlich
hesch öppis vor hüt oder eher entspannt?,neutral,smalltalk,True,hesch oeppis vor huet oder eher entspannt
wie steigsch so i dä morgä?,neutral,smalltalk,True,wie steigsch so i dae morgae
isch öppis spannends aagleit für dich?,neutral,smalltalk,True,isch oeppis spannends aagleit fuer dich
wie gaht s dir im grosse und ganze?,neutral,smalltalk,True,wie gaht s dir im grosse und ganze
wie het dä tag bisher usgseh bi dir?,neutral,smalltalk,True,wie het dae tag bisher usgseh bi dir
schöns wetter hüt – hesch s gniesse chönne?,neutral,smalltalk,True,schoens wetter huet hesch s gniesse choenne
wie lauft s jobmässig grad?,neutral,smalltalk,True,wie lauft s jobmaessig grad
wie isch s wucheend so gsi bi dir?,neutral,smalltalk,True,wie isch s wucheend so gsi bi dir
isch alles im grüene bereich?,neutral,smalltalk,True,isch alles im grueene bereich
wie lauft s grad privat so?,neutral,smalltalk,True,wie lauft s grad privat so
was hesch gister so angestellt?,neutral,smalltalk,True,was hesch gister so angestellt
"wie goht s dim umfeld, alles easy?",neutral,smalltalk,True,wie goht s dim umfeld alles easy
hesch letztens öppis cools erlebt?,neutral,smalltalk,True,hesch letztens oeppis cools erlebt
wie isch dini stimmig hüt unterwegs?,neutral,smalltalk,True,wie isch dini stimmig huet unterwegs
wie würdsch dini situation grad beschriebe?,neutral,smalltalk,True,wie wuerdsch dini situation grad beschriebe
isch s grad eher ruhig oder meh stressig bi dir?,neutral,smalltalk,True,isch s grad eher ruhig oder meh stressig bi dir
wie het sich dä tag bis jetzt aagfühlt?,neutral,smalltalk,True,wie het sich dae tag bis jetzt aagfuehlt
wie hesch du dä morn aagfange?,neutral,smalltalk,True,wie hesch du dae morn aagfange
"na, wie rennsch so dur dä tag hüt?",neutral,smalltalk,True,na wie rennsch so dur dae tag huet
wenn du müesst – wie wär dini tageslaunä vo 1 bis 10?,neutral,smalltalk,True,wenn du mueesst wie waer dini tageslaunae vo <NUM> bis <NUM>
wänn wür dir am beschte passe fürs treffe?,neutral,orga,True,waenn wuer dir am beschte passe fuers treffe
"chömer s eventuell chli verschiebe, falls nötig?",neutral,orga,True,choemer s eventuell chli verschiebe falls noetig
"passt dir morn, oder isch am abig besser?",neutral,orga,True,passt dir morn oder isch am abig besser
wottsch lieber online abmache oder persönlich?,neutral,orga,True,wottsch lieber online abmache oder persoenlich
welchi uhrziit chämer anpeile bi dir?,neutral,orga,True,welchi uhrziit chaemer anpeile bi dir
wie viel zit hesch ungefäär zur verfüegig?,neutral,orga,True,wie viel zit hesch ungefaeaer zur verfueegig
söll ich dir d details grad schnell schicke?,neutral,orga,True,soell ich dir d details grad schnell schicke
"wottsch, dass ich dir en kalender-eintrag mach?",neutral,orga,True,wottsch dass ich dir en kalender eintrag mach
für wänn söttemer s grob apegge?,neutral,orga,True,fuer waenn soettemer s grob apegge
chönnts au spöter i de wuche passe bi dir?,neutral,orga,True,choennts au spoeter i de wuche passe bi dir
isch früeh oder eher spoot angenehmer für dich?,neutral,orga,True,isch frueeh oder eher spoot angenehmer fuer dich
wo wär am praktischste ort für s treffe?,neutral,orga,True,wo waer am praktischste ort fuer s treffe
wötsch s fix mache oder lieber no chli flexibel lah?,neutral,orga,True,woetsch s fix mache oder lieber no chli flexibel lah
"chan ich dir paar vorschläg mache, was würke chönt?",neutral,orga,True,chan ich dir paar vorschlaeg mache was wuerke choent
wie dringend bruchsch die info?,neutral,orga,True,wie dringend bruchsch die info
"isch okay, wenn mer s vorerst locker plane?",neutral,orga,True,isch okay wenn mer s vorerst locker plane
söll ich dir no en kleine reminder setze?,neutral,orga,True,soell ich dir no en kleine reminder setze
"wottsch, dass ich di unterwegs grad abhole?",neutral,orga,True,wottsch dass ich di unterwegs grad abhole
